sentence,hypothesis_simple,hypothesis_traditional,clean_sentence,clean_hypothesis_simple,clean_hypothesis_traditional,training_time
明朝官员。,明朝官员,明朝官员,明朝官员,明朝官员,明朝官员,3950.6493270397186
他曾经在哥伦比亚大学执教。,他曾经在哥伦比亚大学执教,他曾经在哥伦比亚大学执教,他曾经在哥伦比亚大学执教,他曾经在哥伦比亚大学执教,他曾经在哥伦比亚大学执教,3950.6493270397186
武田信吉。,五田信吉,五田信吉,武田信吉,五田信吉,五田信吉,3950.6493270397186
但苹果后来批准该应用发布更新。,但苹果后来批准该应用发布更新,但苹果后来批准该应用发布更新,但苹果后来批准该应用发布更新,但苹果后来批准该应用发布更新,但苹果后来批准该应用发布更新,3950.6493270397186
他在奥尔巴尼大学有教育和法文双教授衔。,他在阿尔巴尼大学有教育和法文双教授衔,他在阿尔巴尼大学有教育和法文双教授衔,他在奥尔巴尼大学有教育和法文双教授衔,他在阿尔巴尼大学有教育和法文双教授衔,他在阿尔巴尼大学有教育和法文双教授衔,3950.6493270397186
该枪面向民用娱乐射击市场。,该枪面向民用娱乐射击市场,该枪面向民用娱乐射击市场,该枪面向民用娱乐射击市场,该枪面向民用娱乐射击市场,该枪面向民用娱乐射击市场,3950.6493270397186
阿拉伯狒狒主要生活在半沙漠地带。,阿拉伯废匪主要生活在半沙漠地带,阿拉伯废匪主要生活在半沙漠地带,阿拉伯狒狒主要生活在半沙漠地带,阿拉伯废匪主要生活在半沙漠地带,阿拉伯废匪主要生活在半沙漠地带,3950.6493270397186
正交配置是偏微分方程数值解的一种方法。,正交配置是偏微分方程数直解的一种方法,正交配置是偏微分方程数直解的一种方法,正交配置是偏微分方程数值解的一种方法,正交配置是偏微分方程数直解的一种方法,正交配置是偏微分方程数直解的一种方法,3950.6493270397186
中国药典已被世界卫生组织认定为中国官方药典。,中国药典已被世界卫生组织认定为中国官方药典,中国药典已被世界卫生组织认定为中国官方药典,中国药典已被世界卫生组织认定为中国官方药典,中国药典已被世界卫生组织认定为中国官方药典,中国药典已被世界卫生组织认定为中国官方药典,3950.6493270397186
认定眼前是妖怪无误的两人马上拔出了佩刀。,认定眼前是妖怪无物的两人马上拔出了佩刀,认定眼前是妖怪无物的两人马上拔出了佩刀,认定眼前是妖怪无误的两人马上拔出了佩刀,认定眼前是妖怪无物的两人马上拔出了佩刀,认定眼前是妖怪无物的两人马上拔出了佩刀,3950.6493270397186
西戎是日本将棋的棋子之一。,西戎是日本将棋的棋子之一,西戎是日本将棋的棋子之一,西戎是日本将棋的棋子之一,西戎是日本将棋的棋子之一,西戎是日本将棋的棋子之一,3950.6493270397186
皮尔格批评了许多主流媒体的记者。,皮尔格批评了许多主流媒体的记者,皮尔格批评了许多主流媒体的记者,皮尔格批评了许多主流媒体的记者,皮尔格批评了许多主流媒体的记者,皮尔格批评了许多主流媒体的记者,3950.6493270397186
属晋熙郡。,鼠禁西郡,鼠禁西郡,属晋熙郡,鼠禁西郡,鼠禁西郡,3950.6493270397186
陈立业。,陈立业,陈立业,陈立业,陈立业,陈立业,3950.6493270397186
斑腹毛管蚜为毛管蚜科后毛管蚜属下的一个种。,斑腹毛管牙为毛管牙科后毛管牙属下的一个种,斑腹毛管牙为毛管牙科后毛管牙属下的一个种,斑腹毛管蚜为毛管蚜科后毛管蚜属下的一个种,斑腹毛管牙为毛管牙科后毛管牙属下的一个种,斑腹毛管牙为毛管牙科后毛管牙属下的一个种,3950.6493270397186
于松迪普瓦图人口变化图示,余松迪普瓦土人口变化图示,余松迪普瓦土人口变化图示,于松迪普瓦图人口变化图示,余松迪普瓦土人口变化图示,余松迪普瓦土人口变化图示,3950.6493270397186
鳗鲡楚克拉虫为两极科楚克拉虫属的动物。,曼利楚克拉虫为两极颗楚克拉虫属的动物,曼利楚克拉虫为两极颗楚克拉虫属的动物,鳗鲡楚克拉虫为两极科楚克拉虫属的动物,曼利楚克拉虫为两极颗楚克拉虫属的动物,曼利楚克拉虫为两极颗楚克拉虫属的动物,3950.6493270397186
新穆德哈尔建筑是摩尔复兴建筑的一种。,西木德哈尔建筑是摩尔复兴建筑的一种,西木德哈尔建筑是摩尔复兴建筑的一种,新穆德哈尔建筑是摩尔复兴建筑的一种,西木德哈尔建筑是摩尔复兴建筑的一种,西木德哈尔建筑是摩尔复兴建筑的一种,3950.6493270397186
山西玄参为玄参科玄参属下的一个种。,山西玄生为玄生科玄生属下的一个种,山西玄生为玄生科玄生属下的一个种,山西玄参为玄参科玄参属下的一个种,山西玄生为玄生科玄生属下的一个种,山西玄生为玄生科玄生属下的一个种,3950.6493270397186
金丝梅为藤黄科金丝桃属下的一个种。,金丝梅为藤黄和金丝桃属下的一个种,金丝梅为藤黄和金丝桃属下的一个种,金丝梅为藤黄科金丝桃属下的一个种,金丝梅为藤黄和金丝桃属下的一个种,金丝梅为藤黄和金丝桃属下的一个种,3950.6493270397186
在模型论的范畴内这个证明就更困难了。,"在模型论的范畴内,这个证明就更困难了","在模型论的范畴内,这个证明就更困难了",在模型论的范畴内这个证明就更困难了,在模型论的范畴内 这个证明就更困难了,在模型论的范畴内 这个证明就更困难了,3950.6493270397186
这些新材料和技术大体上就是物理性质在微尺度上的应用。,这些新材料和技术大体上就是物理性质在微尺度上的应用,这些新材料和技术大体上就是物理性质在微尺度上的应用,这些新材料和技术大体上就是物理性质在微尺度上的应用,这些新材料和技术大体上就是物理性质在微尺度上的应用,这些新材料和技术大体上就是物理性质在微尺度上的应用,3950.6493270397186
节目讲述了从宋徽宗即位到宋高宗退位期间的历史故事。,节目讲述了从宋徽宗继位到宋高宗退位期间的历史故事,节目讲述了从宋徽宗继位到宋高宗退位期间的历史故事,节目讲述了从宋徽宗即位到宋高宗退位期间的历史故事,节目讲述了从宋徽宗继位到宋高宗退位期间的历史故事,节目讲述了从宋徽宗继位到宋高宗退位期间的历史故事,3950.6493270397186
黄子芊是班上最具名气的一人。,黄子谦是班上最具名气的一人,黄子谦是班上最具名气的一人,黄子芊是班上最具名气的一人,黄子谦是班上最具名气的一人,黄子谦是班上最具名气的一人,3950.6493270397186
哈拉尔三世可以指,哈拉尔30可以值,哈拉尔30可以值,哈拉尔三世可以指,哈拉尔30可以值,哈拉尔30可以值,3950.6493270397186
二水车站亦为集集线的起点。,二水车站意为积极线的起点,二水车站意为积极线的起点,二水车站亦为集集线的起点,二水车站意为积极线的起点,二水车站意为积极线的起点,3950.6493270397186
科伯克谷国家公园也是美国的国家公园中游客数最少的国家公园。,科博克谷国家公园也是美国的国家公园中游客数最少的国家公园,科博克谷国家公园也是美国的国家公园中游客数最少的国家公园,科伯克谷国家公园也是美国的国家公园中游客数最少的国家公园,科博克谷国家公园也是美国的国家公园中游客数最少的国家公园,科博克谷国家公园也是美国的国家公园中游客数最少的国家公园,3950.6493270397186
治所在怀道县。,制作在淮道县,制作在淮道县,治所在怀道县,制作在淮道县,制作在淮道县,3950.6493270397186
达拉斯龙具有许多自衍征。,达拉斯龙具有许多字言证,达拉斯龙具有许多字言证,达拉斯龙具有许多自衍征,达拉斯龙具有许多字言证,达拉斯龙具有许多字言证,3950.6493270397186
绳金塔始建于唐朝天佑年间。,神经塔始建于唐朝天佑年间,神经塔始建于唐朝天佑年间,绳金塔始建于唐朝天佑年间,神经塔始建于唐朝天佑年间,神经塔始建于唐朝天佑年间,3950.6493270397186
此外，多位积极的活动家也参与了典礼。,此外多位积极的活动家也参与了典礼,此外多位积极的活动家也参与了典礼,此外 多位积极的活动家也参与了典礼,此外多位积极的活动家也参与了典礼,此外多位积极的活动家也参与了典礼,3950.6493270397186
案中三名被告分别是莫世健、李玉培及杨曼曼，当中李玉培和杨曼曼为从犯。,案中三名被告分别是莫世健、李玉培及杨曼曼当中李玉培和杨曼曼为从犯,案中三名被告分别是莫世健、李玉培及杨曼曼当中李玉培和杨曼曼为从犯,案中三名被告分别是莫世健 李玉培及杨曼曼 当中李玉培和杨曼曼为从犯,案中三名被告分别是莫世健 李玉培及杨曼曼当中李玉培和杨曼曼为从犯,案中三名被告分别是莫世健 李玉培及杨曼曼当中李玉培和杨曼曼为从犯,3950.6493270397186
而零声母符号表示。,而林生武符号表示,而林生武符号表示,而零声母符号表示,而林生武符号表示,而林生武符号表示,3950.6493270397186
过去的研究报告以及来源借助于新科技数位人类学的帮助。,过去的研究报告以及来源借助于新科技数位人类学的帮助,过去的研究报告以及来源借助于新科技数位人类学的帮助,过去的研究报告以及来源借助于新科技数位人类学的帮助,过去的研究报告以及来源借助于新科技数位人类学的帮助,过去的研究报告以及来源借助于新科技数位人类学的帮助,3950.6493270397186
哈德利也设计了位于皮尔斯县的。,哈德利也设计了位于皮尔斯县的,哈德利也设计了位于皮尔斯县的,哈德利也设计了位于皮尔斯县的,哈德利也设计了位于皮尔斯县的,哈德利也设计了位于皮尔斯县的,3950.6493270397186
在义大利，摩托车也在低排放区的适用范围之内。,"在意大利,摩托车也在低排放区的适用范围之内","在意大利,摩托车也在低排放区的适用范围之内",在义大利 摩托车也在低排放区的适用范围之内,在意大利 摩托车也在低排放区的适用范围之内,在意大利 摩托车也在低排放区的适用范围之内,3950.6493270397186
杰罗姆·鲍威尔，出身法律界，曾任律师、投资银行家。,"杰罗姆·鲍威尔出身法律界,曾任律师,投资银行家。","杰罗姆·鲍威尔出身法律界,曾任律师,投资银行家。",杰罗姆 鲍威尔 出身法律界 曾任律师 投资银行家,杰罗姆 鲍威尔出身法律界 曾任律师 投资银行家,杰罗姆 鲍威尔出身法律界 曾任律师 投资银行家,3950.6493270397186
季子可以指：,妓子可以指,妓子可以指,季子可以指,妓子可以指,妓子可以指,3950.6493270397186
这给他游遍中国的机会并跟随一个老派的儒学人士学习中文。,这给他游遍中国的机会并跟随一个老派的儒学人士学习中文,这给他游遍中国的机会并跟随一个老派的儒学人士学习中文,这给他游遍中国的机会并跟随一个老派的儒学人士学习中文,这给他游遍中国的机会并跟随一个老派的儒学人士学习中文,这给他游遍中国的机会并跟随一个老派的儒学人士学习中文,3950.6493270397186
他杀害的女性多为按摩女。,他杀害的女性多为按摩女,他杀害的女性多为按摩女,他杀害的女性多为按摩女,他杀害的女性多为按摩女,他杀害的女性多为按摩女,3950.6493270397186
乐团经常尝试从电脑上其他音乐档案重新创作拍子，最后呈现出原有节奏的修改版本。,"玉团经常尝试从电脑上其他音乐档案重新创作拍子,最后呈现出原有节奏的修改版本。","玉团经常尝试从电脑上其他音乐档案重新创作拍子,最后呈现出原有节奏的修改版本。",乐团经常尝试从电脑上其他音乐档案重新创作拍子 最后呈现出原有节奏的修改版本,玉团经常尝试从电脑上其他音乐档案重新创作拍子 最后呈现出原有节奏的修改版本,玉团经常尝试从电脑上其他音乐档案重新创作拍子 最后呈现出原有节奏的修改版本,3950.6493270397186
赛巴斯提阿诺·维涅尔，是一名意大利政治家和军事家。,塞巴斯提阿诺·威涅尔是一名意大利政治家和军事家,塞巴斯提阿诺·威涅尔是一名意大利政治家和军事家,赛巴斯提阿诺 维涅尔 是一名意大利政治家和军事家,塞巴斯提阿诺 威涅尔是一名意大利政治家和军事家,塞巴斯提阿诺 威涅尔是一名意大利政治家和军事家,3950.6493270397186
所有泛美洲羽毛球联合会辖下的会员都具有参赛资格。,所有泛美洲羽毛球联合会辖下的会员都具有参赛资格,所有泛美洲羽毛球联合会辖下的会员都具有参赛资格,所有泛美洲羽毛球联合会辖下的会员都具有参赛资格,所有泛美洲羽毛球联合会辖下的会员都具有参赛资格,所有泛美洲羽毛球联合会辖下的会员都具有参赛资格,3950.6493270397186
嘉靖四十一年，登进士第二甲第四十六名。,"嘉靖四十一年,登靖是第二甲第四十六名。","嘉靖四十一年,登靖是第二甲第四十六名。",嘉靖四十一年 登进士第二甲第四十六名,嘉靖四十一年 登靖是第二甲第四十六名,嘉靖四十一年 登靖是第二甲第四十六名,3950.6493270397186
遂被押于文登监狱，后转至山东省反省院。,"遂被押于文灯监狱,后转至山东省反省院","遂被押於文燈監獄,後轉至山東省反省院",遂被押于文登监狱 后转至山东省反省院,遂被押于文灯监狱 后转至山东省反省院,遂被押於文燈監獄 後轉至山東省反省院,3950.6493270397186
赵德光可以是指：,照德光可以释止,照德光可以释止,赵德光可以是指,照德光可以释止,照德光可以释止,3950.6493270397186
在位三十年去世，谥号严。,"在位三十年去世,世浩言","在位三十年去世,世浩言",在位三十年去世 谥号严,在位三十年去世 世浩言,在位三十年去世 世浩言,3950.6493270397186
周继，字善卿，山东济南府历城县人，民籍，明朝政治人物、进士出身。,周继自汕青山东济南府历产线人明吉明朝政治人物近世出身,周继自汕青山东济南府历产线人明吉明朝政治人物近世出身,周继 字善卿 山东济南府历城县人 民籍 明朝政治人物 进士出身,周继自汕青山东济南府历产线人明吉明朝政治人物近世出身,周继自汕青山东济南府历产线人明吉明朝政治人物近世出身,3950.6493270397186
成都博物馆通过其官网和官方微博账号发布博物馆动态。,成都博物馆通过其官网和官方微博账号发布博物馆动态,成都博物馆通过其官网和官方微博账号发布博物馆动态,成都博物馆通过其官网和官方微博账号发布博物馆动态,成都博物馆通过其官网和官方微博账号发布博物馆动态,成都博物馆通过其官网和官方微博账号发布博物馆动态,3950.6493270397186
该御瓷厂主要服务于皇家，其生产出的作品常作为礼物赠送给外国政要。,"该浴瓷厂主要服务于皇家,其生产出的作品常作为礼物赠送给外国镇要。","该浴瓷厂主要服务于皇家,其生产出的作品常作为礼物赠送给外国镇要。",该御瓷厂主要服务于皇家 其生产出的作品常作为礼物赠送给外国政要,该浴瓷厂主要服务于皇家 其生产出的作品常作为礼物赠送给外国镇要,该浴瓷厂主要服务于皇家 其生产出的作品常作为礼物赠送给外国镇要,3950.6493270397186
类似的目击还发生过多次，其中不乏受尊重人士。,"类似的目击还发生过多次,其中不乏受尊重人士。","类似的目击还发生过多次,其中不乏受尊重人士。",类似的目击还发生过多次 其中不乏受尊重人士,类似的目击还发生过多次 其中不乏受尊重人士,类似的目击还发生过多次 其中不乏受尊重人士,3950.6493270397186
李承选，字俊卿，河南开封府延津县人，民籍，明朝政治人物、进士出身。,"李成选自郡亲河南开封府延京县人,名籍明朝政治人物,近世出身。","李成选自郡亲河南开封府延京县人,名籍明朝政治人物,近世出身。",李承选 字俊卿 河南开封府延津县人 民籍 明朝政治人物 进士出身,李成选自郡亲河南开封府延京县人 名籍明朝政治人物 近世出身,李成选自郡亲河南开封府延京县人 名籍明朝政治人物 近世出身,3950.6493270397186
黄辉祥华裔商人、运动员。,黄辉祥 华裔商人 运动员,黃輝祥 華裔商人 運動員,黄辉祥华裔商人 运动员,黄辉祥 华裔商人 运动员,黃輝祥 華裔商人 運動員,3950.6493270397186
北戴河近代建筑群主要包括：已毁的着名近代建筑有：,北戴河近代建筑群主要包括夷回的著名近代建筑有,北戴河近代建筑群主要包括夷回的著名近代建筑有,北戴河近代建筑群主要包括 已毁的着名近代建筑有,北戴河近代建筑群主要包括夷回的著名近代建筑有,北戴河近代建筑群主要包括夷回的著名近代建筑有,3950.6493270397186
周宇女，湖北省武汉市人，中华人民共和国外交部官员，中共十九大代表。,周瑜女 湖北省武汉市人中华人民共和国外交部官员中共十九大代表,周瑜女 湖北省武漢市人中華人民共和國外交部官員中共十九大代表,周宇女 湖北省武汉市人 中华人民共和国外交部官员 中共十九大代表,周瑜女 湖北省武汉市人中华人民共和国外交部官员中共十九大代表,周瑜女 湖北省武漢市人中華人民共和國外交部官員中共十九大代表,3950.6493270397186
属安定郡。,鼠安定俊,鼠安定俊,属安定郡,鼠安定俊,鼠安定俊,3950.6493270397186
现在这座建筑是弗雷德里克·萧邦学会的所在地，并且也是萧邦博物馆的展馆建筑。,现在这座建筑是弗雷德里克销帮学会的所在地并且也是销帮博物馆的展馆建筑,现在这座建筑是弗雷德里克销帮学会的所在地并且也是销帮博物馆的展馆建筑,现在这座建筑是弗雷德里克 萧邦学会的所在地 并且也是萧邦博物馆的展馆建筑,现在这座建筑是弗雷德里克销帮学会的所在地并且也是销帮博物馆的展馆建筑,现在这座建筑是弗雷德里克销帮学会的所在地并且也是销帮博物馆的展馆建筑,3950.6493270397186
在第五次“围剿”中，根据地被敌占领。,"在第五次围剿中,根据地被抵占领","在第五次围剿中,根据地被抵占领",在第五次 围剿 中 根据地被敌占领,在第五次围剿中 根据地被抵占领,在第五次围剿中 根据地被抵占领,3950.6493270397186
开平路街道是中国山东省青岛市市北区下辖的一个街道。,开平路街道是中国山东省青岛市市北区下辖的一个街道,开平路街道是中国山东省青岛市市北区下辖的一个街道,开平路街道是中国山东省青岛市市北区下辖的一个街道,开平路街道是中国山东省青岛市市北区下辖的一个街道,开平路街道是中国山东省青岛市市北区下辖的一个街道,3950.6493270397186
北魏设僧统，又名沙门统、都统等，是全国僧团最高领袖。,"北魏摄僧统,又名沙门统,都统等,是全国僧团最高领袖。","北魏摄僧统,又名沙门统,都统等,是全国僧团最高领袖。",北魏设僧统 又名沙门统 都统等 是全国僧团最高领袖,北魏摄僧统 又名沙门统 都统等 是全国僧团最高领袖,北魏摄僧统 又名沙门统 都统等 是全国僧团最高领袖,3950.6493270397186
许乃番，浙江仁和人，清朝政治人物。,许乃藩 浙江人和人 清朝政治人物,许乃藩 浙江人和人 清朝政治人物,许乃番 浙江仁和人 清朝政治人物,许乃藩 浙江人和人 清朝政治人物,许乃藩 浙江人和人 清朝政治人物,3950.6493270397186
上海出租车，是指在中国上海市行政区域内行驶和运营的出租车。,上海出租车是指在中国上海市行政区域内行驶和运营的出租车。,上海出租车是指在中国上海市行政区域内行驶和运营的出租车。,上海出租车 是指在中国上海市行政区域内行驶和运营的出租车,上海出租车是指在中国上海市行政区域内行驶和运营的出租车,上海出租车是指在中国上海市行政区域内行驶和运营的出租车,3950.6493270397186
孙正东，安徽灵璧人，汉族，中国共产党党员。,"孙正东,安徽林碧人,汉族,中国共产党党员","孙正东,安徽林碧人,汉族,中国共产党党员",孙正东 安徽灵璧人 汉族 中国共产党党员,孙正东 安徽林碧人 汉族 中国共产党党员,孙正东 安徽林碧人 汉族 中国共产党党员,3950.6493270397186
南瓜妮歌迷俱乐部组成。,南瓜尼歌迷俱乐部组成,南瓜尼歌迷俱乐部组成,南瓜妮歌迷俱乐部组成,南瓜尼歌迷俱乐部组成,南瓜尼歌迷俱乐部组成,3950.6493270397186
既用排满之说疑误满人，更借灭汉之说激耸汉人，离间谗构狡谲已极。,既用排满之说一物满人更借灭汉之说击耸汉人离间缠构 搅掘已及,既用排满之说一物满人更借灭汉之说击耸汉人离间缠构 搅掘已及,既用排满之说疑误满人 更借灭汉之说激耸汉人 离间谗构狡谲已极,既用排满之说一物满人更借灭汉之说击耸汉人离间缠构 搅掘已及,既用排满之说一物满人更借灭汉之说击耸汉人离间缠构 搅掘已及,3950.6493270397186
吉林省图书馆成立于清宣统元年，馆舍设在当时的吉林省府所在地吉林市。,"吉林省图书馆成立于清宣统元年,馆设设在当时的吉林省府所在地吉林市。","吉林省图书馆成立于清宣统元年,馆设设在当时的吉林省府所在地吉林市。",吉林省图书馆成立于清宣统元年 馆舍设在当时的吉林省府所在地吉林市,吉林省图书馆成立于清宣统元年 馆设设在当时的吉林省府所在地吉林市,吉林省图书馆成立于清宣统元年 馆设设在当时的吉林省府所在地吉林市,3950.6493270397186
流浪动物花园，全称中华民国流浪动物花园协会，是台湾的一个动物保护组织。,流浪动物花园全称中华民国流浪动物花园协会是台湾的一个动物保护组织,流浪动物花园全称中华民国流浪动物花园协会是台湾的一个动物保护组织,流浪动物花园 全称中华民国流浪动物花园协会 是台湾的一个动物保护组织,流浪动物花园全称中华民国流浪动物花园协会是台湾的一个动物保护组织,流浪动物花园全称中华民国流浪动物花园协会是台湾的一个动物保护组织,3950.6493270397186
中华民国成立后，在英属加拿大设置总领事馆。,"中华民国成立后,在英属加拿大设置总领事馆。","中华民国成立后,在英属加拿大设置总领事馆。",中华民国成立后 在英属加拿大设置总领事馆,中华民国成立后 在英属加拿大设置总领事馆,中华民国成立后 在英属加拿大设置总领事馆,3950.6493270397186
然而，在一般的条件下，最小充分统计量总是存在的。,"然而在一般的条件下,最小充分统计量总是存在的。","然而在一般的条件下,最小充分统计量总是存在的。",然而 在一般的条件下 最小充分统计量总是存在的,然而在一般的条件下 最小充分统计量总是存在的,然而在一般的条件下 最小充分统计量总是存在的,3950.6493270397186
日军将三式炮战车定位为自走炮兼驱逐战车。,日军将三式炮战车定位为自走炮兼驱逐战车,日军将三式炮战车定位为自走炮兼驱逐战车,日军将三式炮战车定位为自走炮兼驱逐战车,日军将三式炮战车定位为自走炮兼驱逐战车,日军将三式炮战车定位为自走炮兼驱逐战车,3950.6493270397186
高庄可以指：,高桩可以止,高樁可以止,高庄可以指,高桩可以止,高樁可以止,3950.6493270397186
廖淑惠，出生于云林县农户，家中排行第三。,"廖淑慧出生于云林县农户,家中排行第三。","廖淑慧出生于云林县农户,家中排行第三。",廖淑惠 出生于云林县农户 家中排行第三,廖淑慧出生于云林县农户 家中排行第三,廖淑慧出生于云林县农户 家中排行第三,3950.6493270397186
即西方三圣接引图。,及西方三圣接引图,及西方三圣接引图,即西方三圣接引图,及西方三圣接引图,及西方三圣接引图,3950.6493270397186
金城是位于美国阿肯色州拉法叶县的一个非建制地区。,京城是位于美国阿肯色州拉法叶县的一个非建制地区。,京城是位于美国阿肯色州拉法叶县的一个非建制地区。,金城是位于美国阿肯色州拉法叶县的一个非建制地区,京城是位于美国阿肯色州拉法叶县的一个非建制地区,京城是位于美国阿肯色州拉法叶县的一个非建制地区,3950.6493270397186
