sentence,hypothesis_simple,hypothesis_traditional,clean_sentence,clean_hypothesis_simple,clean_hypothesis_traditional,training_time
恩特罗讷新堡人口变化图示,恩特罗纳辛堡人口变化图示,恩特罗纳辛堡人口变化图示,恩特罗讷新堡人口变化图示,恩特罗纳辛堡人口变化图示,恩特罗纳辛堡人口变化图示,3950.6493270397186
要如何突破当前汉字教育的困境呢？,要如何突破当前汉字教育的困境呢?,要如何突破当前汉字教育的困境呢?,要如何突破当前汉字教育的困境呢,要如何突破当前汉字教育的困境呢,要如何突破当前汉字教育的困境呢,3950.6493270397186
鞍叶藓为细鳞藓科鞍叶藓属下的一个种。,安涅贤为系林显科安涅贤属下的一个种,安涅贤为系林显科安涅贤属下的一个种,鞍叶藓为细鳞藓科鞍叶藓属下的一个种,安涅贤为系林显科安涅贤属下的一个种,安涅贤为系林显科安涅贤属下的一个种,3950.6493270397186
于是辽圣宗耶律隆绪将他处死。,"于是,辽圣宗约旅龙旭将他处死。","于是,辽圣宗约旅龙旭将他处死。",于是辽圣宗耶律隆绪将他处死,于是 辽圣宗约旅龙旭将他处死,于是 辽圣宗约旅龙旭将他处死,3950.6493270397186
山东女子学院是中国山东省济南市的一所本科层次全日制公办高等院校。,山东女子学院是中国山中省济南市一所本科层次全日制公办高等院校,山东女子学院是中国山中省济南市一所本科层次全日制公办高等院校,山东女子学院是中国山东省济南市的一所本科层次全日制公办高等院校,山东女子学院是中国山中省济南市一所本科层次全日制公办高等院校,山东女子学院是中国山中省济南市一所本科层次全日制公办高等院校,3950.6493270397186
平远县大部分居民讲客家话。,平原县大部分居民讲客家话,平原县大部分居民讲客家话,平远县大部分居民讲客家话,平原县大部分居民讲客家话,平原县大部分居民讲客家话,3950.6493270397186
卡勃罗是位于美国北卡罗来纳州奥兰治县的一座小城市。,卡布罗是位于美国北卡罗来纳州奥兰治县的一座小城市,卡布罗是位于美国北卡罗来纳州奥兰治县的一座小城市,卡勃罗是位于美国北卡罗来纳州奥兰治县的一座小城市,卡布罗是位于美国北卡罗来纳州奥兰治县的一座小城市,卡布罗是位于美国北卡罗来纳州奥兰治县的一座小城市,3950.6493270397186
哈局在牡丹江成立铁路分局。,哈菊在牡丹江成立铁路分局,哈菊在牡丹江成立铁路分局,哈局在牡丹江成立铁路分局,哈菊在牡丹江成立铁路分局,哈菊在牡丹江成立铁路分局,3950.6493270397186
莱奥本附近圣斯特凡是奥地利施蒂利亚州莱奥本县的一个市镇。,"莱奥本附近,圣斯特凡是奥地利施地亚州莱奥本县的一个市镇","莱奥本附近,圣斯特凡是奥地利施地亚州莱奥本县的一个市镇",莱奥本附近圣斯特凡是奥地利施蒂利亚州莱奥本县的一个市镇,莱奥本附近 圣斯特凡是奥地利施地亚州莱奥本县的一个市镇,莱奥本附近 圣斯特凡是奥地利施地亚州莱奥本县的一个市镇,3950.6493270397186
此点我们也可藉由时空图的方法来表现出。,此点我们也可具有时空图的方法来表现出,此点我们也可具有时空图的方法来表现出,此点我们也可藉由时空图的方法来表现出,此点我们也可具有时空图的方法来表现出,此点我们也可具有时空图的方法来表现出,3950.6493270397186
该输入法最早的开发者是软件工程师工藤拓和小松弘幸。,该输入法最早的开发者是软件工程师宫腾拓和小松红杏,该输入法最早的开发者是软件工程师宫腾拓和小松红杏,该输入法最早的开发者是软件工程师工藤拓和小松弘幸,该输入法最早的开发者是软件工程师宫腾拓和小松红杏,该输入法最早的开发者是软件工程师宫腾拓和小松红杏,3950.6493270397186
临江市的工业区和经济开发区位于三道沟河流域内。,临江市的工业区和经济开发区位于三道沟河流域内,临江市的工业区和经济开发区位于三道沟河流域内,临江市的工业区和经济开发区位于三道沟河流域内,临江市的工业区和经济开发区位于三道沟河流域内,临江市的工业区和经济开发区位于三道沟河流域内,3950.6493270397186
它们在酸性溶液中的电势介于过氧化氢的电势之间。,他们在宣传文明中的电视介于过氧化铅的变数之间,他们在宣传文明中的电视介于过氧化铅的变数之间,它们在酸性溶液中的电势介于过氧化氢的电势之间,他们在宣传文明中的电视介于过氧化铅的变数之间,他们在宣传文明中的电视介于过氧化铅的变数之间,3950.6493270397186
李同度。,李同渡,李同渡,李同度,李同渡,李同渡,3950.6493270397186
凤凰寺位于湖南省怀化市沅陵县沅江南岸的凤凰山上。,凤凰寺位于湖南省淮化市元陵县元江南岸的凤凰山上,凤凰寺位于湖南省淮化市元陵县元江南岸的凤凰山上,凤凰寺位于湖南省怀化市沅陵县沅江南岸的凤凰山上,凤凰寺位于湖南省淮化市元陵县元江南岸的凤凰山上,凤凰寺位于湖南省淮化市元陵县元江南岸的凤凰山上,3950.6493270397186
部分房屋屋顶的木瓦被风吹飞。,部分房屋屋顶的木瓦被风吹飞,部分房屋屋顶的木瓦被风吹飞,部分房屋屋顶的木瓦被风吹飞,部分房屋屋顶的木瓦被风吹飞,部分房屋屋顶的木瓦被风吹飞,3950.6493270397186
另外美术室及体育部增设冷气。,"另外,美术士及体育部增设冷气","另外,美术士及体育部增设冷气",另外美术室及体育部增设冷气,另外 美术士及体育部增设冷气,另外 美术士及体育部增设冷气,3950.6493270397186
巴仑台黄庙位于天山腹地的巴音郭楞蒙古自治州和静县巴仑台镇。,巴伦台皇庙位于天山腹地的巴音郭冷蒙古自治州合境县巴伦台镇。,巴伦台皇庙位于天山腹地的巴音郭冷蒙古自治州合境县巴伦台镇。,巴仑台黄庙位于天山腹地的巴音郭楞蒙古自治州和静县巴仑台镇,巴伦台皇庙位于天山腹地的巴音郭冷蒙古自治州合境县巴伦台镇,巴伦台皇庙位于天山腹地的巴音郭冷蒙古自治州合境县巴伦台镇,3950.6493270397186
丘陵老鹳草为牻牛儿苗科老鹳草属的植物。,丘陵老灌草为盲牛儿苗科老灌草鼠的植物,丘陵老灌草为盲牛儿苗科老灌草鼠的植物,丘陵老鹳草为牻牛儿苗科老鹳草属的植物,丘陵老灌草为盲牛儿苗科老灌草鼠的植物,丘陵老灌草为盲牛儿苗科老灌草鼠的植物,3950.6493270397186
东非蜂的授粉效果也比欧洲蜂差。,东非风的授粉效果也比欧洲风差,东非风的授粉效果也比欧洲风差,东非蜂的授粉效果也比欧洲蜂差,东非风的授粉效果也比欧洲风差,东非风的授粉效果也比欧洲风差,3950.6493270397186
佩纳福蒂是巴西塞阿拉州的一个市镇。,佩纳福地是巴西塞阿拉州的一个市镇,佩纳福地是巴西塞阿拉州的一个市镇,佩纳福蒂是巴西塞阿拉州的一个市镇,佩纳福地是巴西塞阿拉州的一个市镇,佩纳福地是巴西塞阿拉州的一个市镇,3950.6493270397186
上加尔萨斯是巴西马托格罗索州的一个市镇。,上加尔萨斯是巴西马托格罗索州的一个市镇,上加尔萨斯是巴西马托格罗索州的一个市镇,上加尔萨斯是巴西马托格罗索州的一个市镇,上加尔萨斯是巴西马托格罗索州的一个市镇,上加尔萨斯是巴西马托格罗索州的一个市镇,3950.6493270397186
白铅铝矿是一种罕见的碳酸铝矿物。,白氢铝矿是一种罕见的碳酸铝矿物,白氢铝矿是一种罕见的碳酸铝矿物,白铅铝矿是一种罕见的碳酸铝矿物,白氢铝矿是一种罕见的碳酸铝矿物,白氢铝矿是一种罕见的碳酸铝矿物,3950.6493270397186
吴尊其后发展重心转战大银幕拍摄电影和电视剧。,无尊其后发展中心转战大营拍摄电影和电视剧,无尊其后发展中心转战大营拍摄电影和电视剧,吴尊其后发展重心转战大银幕拍摄电影和电视剧,无尊其后发展中心转战大营拍摄电影和电视剧,无尊其后发展中心转战大营拍摄电影和电视剧,3950.6493270397186
非法森林开发亦为一些村民的收入来源。,非法村民开发以为一些村民的收入来源,非法村民开发以为一些村民的收入来源,非法森林开发亦为一些村民的收入来源,非法村民开发以为一些村民的收入来源,非法村民开发以为一些村民的收入来源,3950.6493270397186
本站位于与交界的明治通地下。,本站位于交界的明治通地下,本站位于交界的明治通地下,本站位于与交界的明治通地下,本站位于交界的明治通地下,本站位于交界的明治通地下,3950.6493270397186
首府为曼布劳。,收服回满座,收服回满座,首府为曼布劳,收服回满座,收服回满座,3950.6493270397186
科朗西。,克朗西,克朗西,科朗西,克朗西,克朗西,3950.6493270397186
它也介绍和翻译过很多近代世界文学作品。,他也介绍和翻译过很多近代世界文学作品,他也介绍和翻译过很多近代世界文学作品,它也介绍和翻译过很多近代世界文学作品,他也介绍和翻译过很多近代世界文学作品,他也介绍和翻译过很多近代世界文学作品,3950.6493270397186
越前国的敦贺和拥有众多中国人所居住的博多都是当时重要的贸易据点。,越南国的多货河拥有众多中国人所居住的不多都是当时重要的贸易区间,越南国的多货河拥有众多中国人所居住的不多都是当时重要的贸易区间,越前国的敦贺和拥有众多中国人所居住的博多都是当时重要的贸易据点,越南国的多货河拥有众多中国人所居住的不多都是当时重要的贸易区间,越南国的多货河拥有众多中国人所居住的不多都是当时重要的贸易区间,3950.6493270397186
父亲为前建设事务次官及鸟取县知事石破二朗。,父亲为前建设十五次观及鸟取献之事石铺二郎,父亲为前建设十五次观及鸟取献之事石铺二郎,父亲为前建设事务次官及鸟取县知事石破二朗,父亲为前建设十五次观及鸟取献之事石铺二郎,父亲为前建设十五次观及鸟取献之事石铺二郎,3950.6493270397186
山东青年政治学院是一所山东省属普通本科高校。,山东青年政治学院是一所山东省是普通本科高校,山东青年政治学院是一所山东省是普通本科高校,山东青年政治学院是一所山东省属普通本科高校,山东青年政治学院是一所山东省是普通本科高校,山东青年政治学院是一所山东省是普通本科高校,3950.6493270397186
此机驾驶由中间控制杆和左手节流阀为主要控制。,此机驾驶由中间控制杆和左手节流阀为主要控制,此机驾驶由中间控制杆和左手节流阀为主要控制,此机驾驶由中间控制杆和左手节流阀为主要控制,此机驾驶由中间控制杆和左手节流阀为主要控制,此机驾驶由中间控制杆和左手节流阀为主要控制,3950.6493270397186
崛起于魏晋。,绝食鱼味精,絕食魚味精,崛起于魏晋,绝食鱼味精,絕食魚味精,3950.6493270397186
他的父亲拥有一家童装制衣厂。,他的父亲拥有一家童装之一场,他的父亲拥有一家童装之一场,他的父亲拥有一家童装制衣厂,他的父亲拥有一家童装之一场,他的父亲拥有一家童装之一场,3950.6493270397186
同时她还出任全国人大机关党组成员。,"同时,他还出任全国人大机关党主成员","同时,他还出任全国人大机关党主成员",同时她还出任全国人大机关党组成员,同时 他还出任全国人大机关党主成员,同时 他还出任全国人大机关党主成员,3950.6493270397186
本条目的范围仅局限于赤道以北及国际换日线以西的太平洋水域。,本条目的范围紧急限于赤道一本及国际观众线以西的太平洋水域,本条目的范围紧急限于赤道一本及国际观众线以西的太平洋水域,本条目的范围仅局限于赤道以北及国际换日线以西的太平洋水域,本条目的范围紧急限于赤道一本及国际观众线以西的太平洋水域,本条目的范围紧急限于赤道一本及国际观众线以西的太平洋水域,3950.6493270397186
明末清初山西阳曲人。,"美墨青出,深吸洋起人","美墨青出,深吸洋起人",明末清初山西阳曲人,美墨青出 深吸洋起人,美墨青出 深吸洋起人,3950.6493270397186
分布于海南等地。,分布于海南 等地,分布于海南 等地,分布于海南等地,分布于海南 等地,分布于海南 等地,3950.6493270397186
四十七年。,47年,47年,四十七年,47年,47年,3950.6493270397186
通讷人口变化图示,正在人口变化图示,正在人口变化图示,通讷人口变化图示,正在人口变化图示,正在人口变化图示,3950.6493270397186
道德虚无主义的表达形式之一是表现主义。,道德虚无主义的表达形式之一是表现主义,道德虚无主义的表达形式之一是表现主义,道德虚无主义的表达形式之一是表现主义,道德虚无主义的表达形式之一是表现主义,道德虚无主义的表达形式之一是表现主义,3950.6493270397186
雌雄异型。,吃熊一席,吃熊一席,雌雄异型,吃熊一席,吃熊一席,3950.6493270397186
摄津北交流道是位于大阪府摄津市的近畿自动车道之交流道。,念金北交流道是位于大阪府内京市的最有自动车道的交流道,念金北交流道是位于大阪府内京市的最有自动车道的交流道,摄津北交流道是位于大阪府摄津市的近畿自动车道之交流道,念金北交流道是位于大阪府内京市的最有自动车道的交流道,念金北交流道是位于大阪府内京市的最有自动车道的交流道,3950.6493270397186
这些重型装备往往是单件设计。,这些重型装备往往是单件设计,这些重型装备往往是单件设计,这些重型装备往往是单件设计,这些重型装备往往是单件设计,这些重型装备往往是单件设计,3950.6493270397186
他的政治教父是后来的德国共产党国会议员。,他的政治教父是后来的德国共产党国会议员,他的政治教父是后来的德国共产党国会议员,他的政治教父是后来的德国共产党国会议员,他的政治教父是后来的德国共产党国会议员,他的政治教父是后来的德国共产党国会议员,3950.6493270397186
宇称是一个量子力学量。,宇春是一个量子力学量,宇春是一个量子力学量,宇称是一个量子力学量,宇春是一个量子力学量,宇春是一个量子力学量,3950.6493270397186
他发觉他妈妈用电话向下等人通报了泰德的下落。,他发觉他妈妈一电话想吓得人喷到了太多了笑,他发觉他妈妈一电话想吓得人喷到了太多了笑,他发觉他妈妈用电话向下等人通报了泰德的下落,他发觉他妈妈一电话想吓得人喷到了太多了笑,他发觉他妈妈一电话想吓得人喷到了太多了笑,3950.6493270397186
但目前实际上仅可在长三角部分城市使用。,"但目前时期上,前科在肠腔角部分呈现使用","但目前時期上,前科在腸腔角部分呈現使用",但目前实际上仅可在长三角部分城市使用,但目前时期上 前科在肠腔角部分呈现使用,但目前時期上 前科在腸腔角部分呈現使用,3950.6493270397186
石码杨氏大夫第的历史年代为清。,是马阳市大福地的历史年代国庆,是马阳市大福地的历史年代国庆,石码杨氏大夫第的历史年代为清,是马阳市大福地的历史年代国庆,是马阳市大福地的历史年代国庆,3950.6493270397186
毕业后签约邵氏兄弟有限公司成为基本合约演员。,毕业后签约上市兄弟有限公司成为基本合约演员,毕业后签约上市兄弟有限公司成为基本合约演员,毕业后签约邵氏兄弟有限公司成为基本合约演员,毕业后签约上市兄弟有限公司成为基本合约演员,毕业后签约上市兄弟有限公司成为基本合约演员,3950.6493270397186
该路为台中市东区与南区二区的区界。,它论为台中市东区与南区二区的区间,它论为台中市东区与南区二区的区间,该路为台中市东区与南区二区的区界,它论为台中市东区与南区二区的区间,它论为台中市东区与南区二区的区间,3950.6493270397186
标会至此结束。,开会至此结束,开会至此结束,标会至此结束,开会至此结束,开会至此结束,3950.6493270397186
最终心理学家证实这匹马不能真正地进行计算。,最终幸运学家说的这匹马不能真正能实行寄送,最终幸运学家说的这匹马不能真正能实行寄送,最终心理学家证实这匹马不能真正地进行计算,最终幸运学家说的这匹马不能真正能实行寄送,最终幸运学家说的这匹马不能真正能实行寄送,3950.6493270397186
此列表基本上列出各国宪法所表明的政体。,此列表基本上列出各国宪法所标明的政体,此列表基本上列出各国宪法所标明的政体,此列表基本上列出各国宪法所表明的政体,此列表基本上列出各国宪法所标明的政体,此列表基本上列出各国宪法所标明的政体,3950.6493270397186
密苏里大学坐落于此。,密苏里大学 坐落于此,密苏里大学 坐落于此,密苏里大学坐落于此,密苏里大学 坐落于此,密苏里大学 坐落于此,3950.6493270397186
他的夫人鼓励他去争取一份公共职务。,他的夫人鼓励他去争取一份公共职务,他的夫人鼓励他去争取一份公共职务,他的夫人鼓励他去争取一份公共职务,他的夫人鼓励他去争取一份公共职务,他的夫人鼓励他去争取一份公共职务,3950.6493270397186
宪法中并未提及国旗长宽比。,宪法中并未提及国企长宽比,宪法中并未提及国企长宽比,宪法中并未提及国旗长宽比,宪法中并未提及国企长宽比,宪法中并未提及国企长宽比,3950.6493270397186
入库列车则利用该横渡线前往车库。,入库列车则利用该横渡线乘往车库,入库列车则利用该横渡线乘往车库,入库列车则利用该横渡线前往车库,入库列车则利用该横渡线乘往车库,入库列车则利用该横渡线乘往车库,3950.6493270397186
东京帝国大学教授。,东京帝国大学教授,东京帝国大学教授,东京帝国大学教授,东京帝国大学教授,东京帝国大学教授,3950.6493270397186
在奥兰自治区露营的自由会受到一定的限制。,在奥兰自治区里的自由会受到一定的限制,在奥兰自治区里的自由会受到一定的限制,在奥兰自治区露营的自由会受到一定的限制,在奥兰自治区里的自由会受到一定的限制,在奥兰自治区里的自由会受到一定的限制,3950.6493270397186
这位女神后来成为罗马的库柏勒。,这位女神后来成为罗马的库柏蕾,這位女神後來成為羅馬的庫柏蕾,这位女神后来成为罗马的库柏勒,这位女神后来成为罗马的库柏蕾,這位女神後來成為羅馬的庫柏蕾,3950.6493270397186
大阪府大阪市出身。,大包子大摆是出身,大包子大摆是出身,大阪府大阪市出身,大包子大摆是出身,大包子大摆是出身,3950.6493270397186
隶属于军政部。,你属于金正不,你属于金正不,隶属于军政部,你属于金正不,你属于金正不,3950.6493270397186
官至两浙都转盐运使司盐运使。,"观止两者都转圆定时,思言运使。","观止两者都转圆定时,思言运使。",官至两浙都转盐运使司盐运使,观止两者都转圆定时 思言运使,观止两者都转圆定时 思言运使,3950.6493270397186
史迪威博物馆是重庆重要的陪都遗迹。,是迪威国务馆是重庆重要的陪渡仪器,是迪威国务馆是重庆重要的陪渡仪器,史迪威博物馆是重庆重要的陪都遗迹,是迪威国务馆是重庆重要的陪渡仪器,是迪威国务馆是重庆重要的陪渡仪器,3950.6493270397186
其中管风琴交响乐对管风琴曲目有很大的影响力。,"其中,管风起赵晓月对管风前一曲《木有》具很大的影响力。","其中,管风起赵晓月对管风前一曲《木有》具很大的影响力。",其中管风琴交响乐对管风琴曲目有很大的影响力,其中 管风起赵晓月对管风前一曲 木有 具很大的影响力,其中 管风起赵晓月对管风前一曲 木有 具很大的影响力,3950.6493270397186
改任兴平军节度使。,改任新平君 杰杜氏,改任新平君 杰杜氏,改任兴平军节度使,改任新平君 杰杜氏,改任新平君 杰杜氏,3950.6493270397186
克瑞乌萨。,克瑞乌萨,克瑞乌萨,克瑞乌萨,克瑞乌萨,克瑞乌萨,3950.6493270397186
可发酵糖是通常在发酵行业用到的术语。,可发酵糖是通常在发酵行业用到的术语,可发酵糖是通常在发酵行业用到的术语,可发酵糖是通常在发酵行业用到的术语,可发酵糖是通常在发酵行业用到的术语,可发酵糖是通常在发酵行业用到的术语,3950.6493270397186
其中愉翠苑占整区人口的大约三分之二。,其中渝翠苑占整区人口的大约三分之二,其中渝翠苑占整区人口的大约三分之二,其中愉翠苑占整区人口的大约三分之二,其中渝翠苑占整区人口的大约三分之二,其中渝翠苑占整区人口的大约三分之二,3950.6493270397186
宣州区是中国安徽省宣城市下辖的一个区。,宣州区是中国安徽省宣城市下辖的一个区,宣州区是中国安徽省宣城市下辖的一个区,宣州区是中国安徽省宣城市下辖的一个区,宣州区是中国安徽省宣城市下辖的一个区,宣州区是中国安徽省宣城市下辖的一个区,3950.6493270397186
新城数码财经台是新城电台的一个频道。,新城数码财经台是新城电台的一个频道,新城数码财经台是新城电台的一个频道,新城数码财经台是新城电台的一个频道,新城数码财经台是新城电台的一个频道,新城数码财经台是新城电台的一个频道,3950.6493270397186
他们带了一群人来了,他们带了一群人来了,他们带了一群人来了,他们带了一群人来了,他们带了一群人来了,他们带了一群人来了,3950.6493270397186
这些元素有时也被称作过渡金属。,这些元素有时也被称作过度金属,这些元素有时也被称作过度金属,这些元素有时也被称作过渡金属,这些元素有时也被称作过度金属,这些元素有时也被称作过度金属,3950.6493270397186
如今南面这两层的外廊已经被装上窗户。,"如今,南面这两层的外廊已经被装上窗户","如今,南面这两层的外廊已经被装上窗户",如今南面这两层的外廊已经被装上窗户,如今 南面这两层的外廊已经被装上窗户,如今 南面这两层的外廊已经被装上窗户,3950.6493270397186
加里波第站是巴黎地铁的一个车站。,加里波地站是巴黎地铁的一个车站,加里波地站是巴黎地铁的一个车站,加里波第站是巴黎地铁的一个车站,加里波地站是巴黎地铁的一个车站,加里波地站是巴黎地铁的一个车站,3950.6493270397186
没有证据证明该病和红斑狼疮有关。,没有证据证明该病和红斑蓝疮有关,没有证据证明该病和红斑蓝疮有关,没有证据证明该病和红斑狼疮有关,没有证据证明该病和红斑蓝疮有关,没有证据证明该病和红斑蓝疮有关,3950.6493270397186
未公开,未公开,未公开,未公开,未公开,未公开,3950.6493270397186
防护装甲与巡洋舰相当。,防护装甲与巡洋舰相当,防护装甲与巡洋舰相当,防护装甲与巡洋舰相当,防护装甲与巡洋舰相当,防护装甲与巡洋舰相当,3950.6493270397186
后累升至礼科都给事中。,后磊生智理科都级诗中,后磊生智理科都级诗中,后累升至礼科都给事中,后磊生智理科都级诗中,后磊生智理科都级诗中,3950.6493270397186
他是由比光索的长男。,他是游比光索的长男,他是游比光索的長男,他是由比光索的长男,他是游比光索的长男,他是游比光索的長男,3950.6493270397186
损坏的航空母舰都被迫返回日本进行广泛维修和改装。,损坏的航空母舰都被迫返回日本进行广泛维修和改装,损坏的航空母舰都被迫返回日本进行广泛维修和改装,损坏的航空母舰都被迫返回日本进行广泛维修和改装,损坏的航空母舰都被迫返回日本进行广泛维修和改装,损坏的航空母舰都被迫返回日本进行广泛维修和改装,3950.6493270397186
隆瑟纳克。,龙色纳克,龍色納克,隆瑟纳克,龙色纳克,龍色納克,3950.6493270397186
这意味者有将近一半的动力是被浪费掉的。,这意味着有将近一半的动力是被浪费掉的,这意味着有将近一半的动力是被浪费掉的,这意味者有将近一半的动力是被浪费掉的,这意味着有将近一半的动力是被浪费掉的,这意味着有将近一半的动力是被浪费掉的,3950.6493270397186
克里斯蒂娜是阿根廷历史上第一位民选的女总统。,Christina是阿根廷历史上第一位民选的女总统,Christina是阿根廷历史上第一位民选的女总统,克里斯蒂娜是阿根廷历史上第一位民选的女总统,christina是阿根廷历史上第一位民选的女总统,christina是阿根廷历史上第一位民选的女总统,3950.6493270397186
