sentence,hypothesis_simple,hypothesis_traditional,clean_sentence,clean_hypothesis_simple,clean_hypothesis_traditional,training_time
小鼩鼱为鼩鼱科鼩鼱属的动物。,小麒麟为麒麟喝麒麟鼠的动物,小麒麟为麒麟喝麒麟鼠的动物,小鼩鼱为鼩鼱科鼩鼱属的动物,小麒麟为麒麟喝麒麟鼠的动物,小麒麟为麒麟喝麒麟鼠的动物,3950.6493270397186
他现在效力于塞尔维亚足球超级联赛球队库卡瑞奇足球俱乐部。,他现在效力于塞尔维亚足球超级联赛球队库卡瑞奇足球俱乐部,他现在效力于塞尔维亚足球超级联赛球队库卡瑞奇足球俱乐部,他现在效力于塞尔维亚足球超级联赛球队库卡瑞奇足球俱乐部,他现在效力于塞尔维亚足球超级联赛球队库卡瑞奇足球俱乐部,他现在效力于塞尔维亚足球超级联赛球队库卡瑞奇足球俱乐部,3950.6493270397186
昂格莱人口变化图示,昂德莱人口变化图示,昂德莱人口变化图示,昂格莱人口变化图示,昂德莱人口变化图示,昂德莱人口变化图示,3950.6493270397186
黄色素细胞将沿脊椎和四肢上端排列。,黄色素细胞僵严脊椎和四肢上端排列,黄色素细胞僵严脊椎和四肢上端排列,黄色素细胞将沿脊椎和四肢上端排列,黄色素细胞僵严脊椎和四肢上端排列,黄色素细胞僵严脊椎和四肢上端排列,3950.6493270397186
现在任教于普林斯顿大学物理系。,现在任教于普林斯顿大学物理系,现在任教于普林斯顿大学物理系,现在任教于普林斯顿大学物理系,现在任教于普林斯顿大学物理系,现在任教于普林斯顿大学物理系,3950.6493270397186
柳叶鳞花草为爵床科鳞花草属下的一个种。,柳叶菱花草为绝床科菱花草手下的一种,柳叶菱花草为绝床科菱花草手下的一种,柳叶鳞花草为爵床科鳞花草属下的一个种,柳叶菱花草为绝床科菱花草手下的一种,柳叶菱花草为绝床科菱花草手下的一种,3950.6493270397186
耳笔螺为笔螺科焰笔螺属下的一个种。,而比罗为比罗科燕比罗属下的一个种,而比罗为比罗科燕比罗属下的一个种,耳笔螺为笔螺科焰笔螺属下的一个种,而比罗为比罗科燕比罗属下的一个种,而比罗为比罗科燕比罗属下的一个种,3950.6493270397186
而剩下的列车根据合同则由庞巴迪与长春轨道客车的合资公司于国内生产。,而剩下的列车登记合同则由庞巴迪与长春轨道客车的合资公司与国内生产,而剩下的列车登记合同则由庞巴迪与长春轨道客车的合资公司与国内生产,而剩下的列车根据合同则由庞巴迪与长春轨道客车的合资公司于国内生产,而剩下的列车登记合同则由庞巴迪与长春轨道客车的合资公司与国内生产,而剩下的列车登记合同则由庞巴迪与长春轨道客车的合资公司与国内生产,3950.6493270397186
基里巴斯目前无官方的行政区划。,基里巴斯目前无官方的选证区划,基里巴斯目前无官方的选证区划,基里巴斯目前无官方的行政区划,基里巴斯目前无官方的选证区划,基里巴斯目前无官方的选证区划,3950.6493270397186
该公司主要是通过展示和贸易展览批发销售。,该公司主要是通过展示和贸易展览批发销售,该公司主要是通过展示和贸易展览批发销售,该公司主要是通过展示和贸易展览批发销售,该公司主要是通过展示和贸易展览批发销售,该公司主要是通过展示和贸易展览批发销售,3950.6493270397186
阿马迪纳是巴西巴伊亚州的一个市镇。,阿巴迪是巴西巴伊亚洲的一个市镇,阿巴迪是巴西巴伊亚洲的一个市镇,阿马迪纳是巴西巴伊亚州的一个市镇,阿巴迪是巴西巴伊亚洲的一个市镇,阿巴迪是巴西巴伊亚洲的一个市镇,3950.6493270397186
寺内还有樱木町事故和鹤见事故的慰灵碑。,室内还有樱木挺事故和贺见事故的慰灵碑,室內還有櫻木挺事故和賀見事故的慰靈碑,寺内还有樱木町事故和鹤见事故的慰灵碑,室内还有樱木挺事故和贺见事故的慰灵碑,室內還有櫻木挺事故和賀見事故的慰靈碑,3950.6493270397186
普卢吉恩。,普罗吉恩,普罗吉恩,普卢吉恩,普罗吉恩,普罗吉恩,3950.6493270397186
穆东上沙佩勒的总面积为平方公里。,木东上沙飞的总面积为平方公里,木东上沙飞的总面积为平方公里,穆东上沙佩勒的总面积为平方公里,木东上沙飞的总面积为平方公里,木东上沙飞的总面积为平方公里,3950.6493270397186
以海运和公路为主。,以海运和公路为主,以海运和公路为主,以海运和公路为主,以海运和公路为主,以海运和公路为主,3950.6493270397186
赛区冠军次数,赛期冠军思数,赛期冠军思数,赛区冠军次数,赛期冠军思数,赛期冠军思数,3950.6493270397186
墓内有画像石并绘有壁画。,木内有画像石面会有壁画吗?,木内有画像石面会有壁画吗?,墓内有画像石并绘有壁画,木内有画像石面会有壁画吗,木内有画像石面会有壁画吗,3950.6493270397186
是位于大阪市淀川区的男女共学私立幼儿园。,是位于大阪市电汉市的南宇宏街私立游乐园,是位于大阪市电汉市的南宇宏街私立游乐园,是位于大阪市淀川区的男女共学私立幼儿园,是位于大阪市电汉市的南宇宏街私立游乐园,是位于大阪市电汉市的南宇宏街私立游乐园,3950.6493270397186
银海区是中国广西壮族自治区北海市所辖的一个市辖区。,银海区是中国广西壮族自治区北海市所辖的一道市下区,银海区是中国广西壮族自治区北海市所辖的一道市下区,银海区是中国广西壮族自治区北海市所辖的一个市辖区,银海区是中国广西壮族自治区北海市所辖的一道市下区,银海区是中国广西壮族自治区北海市所辖的一道市下区,3950.6493270397186
红花姬旋花为旋花科菜栾藤属下的一个种。,红花鸡悬花为悬花科菜鸾藤属下的一类种,红花鸡悬花为悬花科菜鸾藤属下的一类种,红花姬旋花为旋花科菜栾藤属下的一个种,红花鸡悬花为悬花科菜鸾藤属下的一类种,红花鸡悬花为悬花科菜鸾藤属下的一类种,3950.6493270397186
一些编码器在很大程度上依赖于这项技术。,一些编码器在很大程度上依赖于这项技术,一些编码器在很大程度上依赖于这项技术,一些编码器在很大程度上依赖于这项技术,一些编码器在很大程度上依赖于这项技术,一些编码器在很大程度上依赖于这项技术,3950.6493270397186
该庙位于中华民国台南市中西区。,该庙位于中华民博台南市中西区,该庙位于中华民博台南市中西区,该庙位于中华民国台南市中西区,该庙位于中华民博台南市中西区,该庙位于中华民博台南市中西区,3950.6493270397186
我这辈子就爱过这一个人。,我这辈子就爱我这一对人,我這輩子就愛我這一對人,我这辈子就爱过这一个人,我这辈子就爱我这一对人,我這輩子就愛我這一對人,3950.6493270397186
黄热病疫苗不应该用于出现症状的爱滋病患者。,黄热病疫苗不应该用于出现症状的艾滋病患者,黄热病疫苗不应该用于出现症状的艾滋病患者,黄热病疫苗不应该用于出现症状的爱滋病患者,黄热病疫苗不应该用于出现症状的艾滋病患者,黄热病疫苗不应该用于出现症状的艾滋病患者,3950.6493270397186
香港日治时期曾用作日本人俱乐部会所。,乡长日志时期曾用作日本人俱乐部会所,乡长日志时期曾用作日本人俱乐部会所,香港日治时期曾用作日本人俱乐部会所,乡长日志时期曾用作日本人俱乐部会所,乡长日志时期曾用作日本人俱乐部会所,3950.6493270397186
他现在效力于意大利足球乙级联赛球队格罗瑟托足球俱乐部。,他现在效力于意大利足球以及联赛球队德罗瑟托足球队的部部,他现在效力于意大利足球以及联赛球队德罗瑟托足球队的部部,他现在效力于意大利足球乙级联赛球队格罗瑟托足球俱乐部,他现在效力于意大利足球以及联赛球队德罗瑟托足球队的部部,他现在效力于意大利足球以及联赛球队德罗瑟托足球队的部部,3950.6493270397186
瓦利亚野山羊是衣索比亚国家足球队的象征。,瓦利亚野山羊是伊索比亚国家足球队的象征,瓦利亚野山羊是伊索比亚国家足球队的象征,瓦利亚野山羊是衣索比亚国家足球队的象征,瓦利亚野山羊是伊索比亚国家足球队的象征,瓦利亚野山羊是伊索比亚国家足球队的象征,3950.6493270397186
一枝黄花和着名的入侵物种加拿大一枝黄花为同科不同种植物。,一枝黄花和着名的入侵物种加拿大一枝黄花为同科不同种植物,一枝黄花和着名的入侵物种加拿大一枝黄花为同科不同种植物,一枝黄花和着名的入侵物种加拿大一枝黄花为同科不同种植物,一枝黄花和着名的入侵物种加拿大一枝黄花为同科不同种植物,一枝黄花和着名的入侵物种加拿大一枝黄花为同科不同种植物,3950.6493270397186
殷栗线,音域线,音域线,殷栗线,音域线,音域线,3950.6493270397186
小尚帕尼亚人口变化图示,小上怕尼亚人口变化图示,小上怕尼亚人口变化图示,小尚帕尼亚人口变化图示,小上怕尼亚人口变化图示,小上怕尼亚人口变化图示,3950.6493270397186
佛教又得以恢复。,佛教又得以恢复,佛教又得以恢复,佛教又得以恢复,佛教又得以恢复,佛教又得以恢复,3950.6493270397186
兰德韦尔是德国下萨克森州的一个市镇。,南德维尔是德国夏萨克森州的一个市镇,南德维尔是德国夏萨克森州的一个市镇,兰德韦尔是德国下萨克森州的一个市镇,南德维尔是德国夏萨克森州的一个市镇,南德维尔是德国夏萨克森州的一个市镇,3950.6493270397186
后元昊在宋庆历三年病逝。,后元昊在宋清丽三年病逝,后元昊在宋清丽三年病逝,后元昊在宋庆历三年病逝,后元昊在宋清丽三年病逝,后元昊在宋清丽三年病逝,3950.6493270397186
奎德林堡的建筑特色为拥有大片的木质结构房屋。,奎德宁堡的建筑特色为拥有大片的木制结构房屋,奎德宁堡的建筑特色为拥有大片的木制结构房屋,奎德林堡的建筑特色为拥有大片的木质结构房屋,奎德宁堡的建筑特色为拥有大片的木制结构房屋,奎德宁堡的建筑特色为拥有大片的木制结构房屋,3950.6493270397186
克鲁泡特金站是莫斯科地铁的一个车站。,克鲁泡特金站是莫斯科地铁的一个车站,克鲁泡特金站是莫斯科地铁的一个车站,克鲁泡特金站是莫斯科地铁的一个车站,克鲁泡特金站是莫斯科地铁的一个车站,克鲁泡特金站是莫斯科地铁的一个车站,3950.6493270397186
绿花玉凤花为兰科玉凤花属下的一个种。,绿花玉凤花为兰科玉凤花属下的一个种,绿花玉凤花为兰科玉凤花属下的一个种,绿花玉凤花为兰科玉凤花属下的一个种,绿花玉凤花为兰科玉凤花属下的一个种,绿花玉凤花为兰科玉凤花属下的一个种,3950.6493270397186
膜荚见血飞是豆科云实属的植物。,摩伽健血肥是豆科鱼食属的植物,摩伽健血肥是豆科鱼食属的植物,膜荚见血飞是豆科云实属的植物,摩伽健血肥是豆科鱼食属的植物,摩伽健血肥是豆科鱼食属的植物,3950.6493270397186
史密斯生于昆士兰布里斯班哈密尔顿市。,史密斯生于昆士兰布里斯班哈密尔顿时,史密斯生于昆士兰布里斯班哈密尔顿时,史密斯生于昆士兰布里斯班哈密尔顿市,史密斯生于昆士兰布里斯班哈密尔顿时,史密斯生于昆士兰布里斯班哈密尔顿时,3950.6493270397186
戈雅克。,歌雅客,歌雅客,戈雅克,歌雅客,歌雅客,3950.6493270397186
普遍的牧师及教会认为这段经文指不可跟不信或未信者结婚。,普遍的牧师及教会会认为这段经文指不可跟不信或未信者结婚,普遍的牧师及教会会认为这段经文指不可跟不信或未信者结婚,普遍的牧师及教会认为这段经文指不可跟不信或未信者结婚,普遍的牧师及教会会认为这段经文指不可跟不信或未信者结婚,普遍的牧师及教会会认为这段经文指不可跟不信或未信者结婚,3950.6493270397186
家人放在客厅,家人放在客厅,家人放在客厅,家人放在客厅,家人放在客厅,家人放在客厅,3950.6493270397186
民国初废。,民国出废,民國出廢,民国初废,民国出废,民國出廢,3950.6493270397186
美国维珍尼亚州马田斯维尔出生。,美国维珍尼亚州马田斯维尔出身,美国维珍尼亚州马田斯维尔出身,美国维珍尼亚州马田斯维尔出生,美国维珍尼亚州马田斯维尔出身,美国维珍尼亚州马田斯维尔出身,3950.6493270397186
主机卡模拟是仅仅使用软件对智能卡进行的虚拟而精确的呈现。,主机卡模拟是仅仅使用软件对智能卡进行的虚拟而精确的呈现,主机卡模拟是仅仅使用软件对智能卡进行的虚拟而精确的呈现,主机卡模拟是仅仅使用软件对智能卡进行的虚拟而精确的呈现,主机卡模拟是仅仅使用软件对智能卡进行的虚拟而精确的呈现,主机卡模拟是仅仅使用软件对智能卡进行的虚拟而精确的呈现,3950.6493270397186
曲目一览曲目一览曲目一览,曲目一览 曲目一览 曲目一览,曲目一览 曲目一览 曲目一览,曲目一览曲目一览曲目一览,曲目一览 曲目一览 曲目一览,曲目一览 曲目一览 曲目一览,3950.6493270397186
出生于东京。,出生于东京,出生於東京,出生于东京,出生于东京,出生於東京,3950.6493270397186
仪仗连改编为中国人民解放军公安警卫师警卫营二连。,一丈年改编为中国人民解放军公安警卫师警卫营二年,一丈年改编为中国人民解放军公安警卫师警卫营二年,仪仗连改编为中国人民解放军公安警卫师警卫营二连,一丈年改编为中国人民解放军公安警卫师警卫营二年,一丈年改编为中国人民解放军公安警卫师警卫营二年,3950.6493270397186
中华民国与保加利亚关系是指中华民国与保加利亚共和国之间的关系。,中华民国与保加利亚关系是指中华民国与保加利亚共和国之间的关系,中华民国与保加利亚关系是指中华民国与保加利亚共和国之间的关系,中华民国与保加利亚关系是指中华民国与保加利亚共和国之间的关系,中华民国与保加利亚关系是指中华民国与保加利亚共和国之间的关系,中华民国与保加利亚关系是指中华民国与保加利亚共和国之间的关系,3950.6493270397186
郭连乡是中国河南省许昌市禹州市下辖的一个乡。,郭年香是中国河南省许昌市玉州市下辖的一个乡,郭年香是中国河南省许昌市玉州市下辖的一个乡,郭连乡是中国河南省许昌市禹州市下辖的一个乡,郭年香是中国河南省许昌市玉州市下辖的一个乡,郭年香是中国河南省许昌市玉州市下辖的一个乡,3950.6493270397186
秦时朝歌邑属三川郡。,秦时曹阁一鼠三川郡,秦时曹阁一鼠三川郡,秦时朝歌邑属三川郡,秦时曹阁一鼠三川郡,秦时曹阁一鼠三川郡,3950.6493270397186
本列表列出苏丹的活火山与死火山。,本列表列出苏丹的火火山与死火山,本列表列出苏丹的火火山与死火山,本列表列出苏丹的活火山与死火山,本列表列出苏丹的火火山与死火山,本列表列出苏丹的火火山与死火山,3950.6493270397186
广东中加柏仁学校。,广东中加博人学校,广东中加博人学校,广东中加柏仁学校,广东中加博人学校,广东中加博人学校,3950.6493270397186
各线之间的转乘客非常多。,各县之间的转乘客非常多,各县之间的转乘客非常多,各线之间的转乘客非常多,各县之间的转乘客非常多,各县之间的转乘客非常多,3950.6493270397186
太原街站为地下岛式站台。,太原接站为地下导师站台,太原接站为地下导师站台,太原街站为地下岛式站台,太原接站为地下导师站台,太原接站为地下导师站台,3950.6493270397186
兰多尔夫斯豪森是德国下萨克森州的一个市镇。,南多尔夫斯豪森市德国夏萨克森州的一个市镇,南多尔夫斯豪森市德国夏萨克森州的一个市镇,兰多尔夫斯豪森是德国下萨克森州的一个市镇,南多尔夫斯豪森市德国夏萨克森州的一个市镇,南多尔夫斯豪森市德国夏萨克森州的一个市镇,3950.6493270397186
此处同时收录蒙古人民共和国时期的国家元首。,此处同时收录蒙古人民共和国时期的国家元首,此处同时收录蒙古人民共和国时期的国家元首,此处同时收录蒙古人民共和国时期的国家元首,此处同时收录蒙古人民共和国时期的国家元首,此处同时收录蒙古人民共和国时期的国家元首,3950.6493270397186
德国是世界遗产数较多的国家之一。,德国是世界遗产数较多的国家之一,德国是世界遗产数较多的国家之一,德国是世界遗产数较多的国家之一,德国是世界遗产数较多的国家之一,德国是世界遗产数较多的国家之一,3950.6493270397186
圣弗洛兰。,圣福落来,圣福落来,圣弗洛兰,圣福落来,圣福落来,3950.6493270397186
然后痛苦不堪决定折返,然后痛苦不堪决定者反,然后痛苦不堪决定者反,然后痛苦不堪决定折返,然后痛苦不堪决定者反,然后痛苦不堪决定者反,3950.6493270397186
古代居住在斯里兰卡的僧伽罗人就已经开始应用水力学的原理。,古代居住在斯里兰卡的森加罗人就已经开始应用水力学的原因,古代居住在斯里兰卡的森加罗人就已经开始应用水力学的原因,古代居住在斯里兰卡的僧伽罗人就已经开始应用水力学的原理,古代居住在斯里兰卡的森加罗人就已经开始应用水力学的原因,古代居住在斯里兰卡的森加罗人就已经开始应用水力学的原因,3950.6493270397186
泰国南端主要是马来人。,泰国南端主要是马来人,泰国南端主要是马来人,泰国南端主要是马来人,泰国南端主要是马来人,泰国南端主要是马来人,3950.6493270397186
原子的大小与影响物质的许多性质。,原子的大小与影响物质的许多性质,原子的大小与影响物质的许多性质,原子的大小与影响物质的许多性质,原子的大小与影响物质的许多性质,原子的大小与影响物质的许多性质,3950.6493270397186
将白果市乡并入凤凰乡。,将白果四香避入凤凰香,将白果四香避入凤凰香,将白果市乡并入凤凰乡,将白果四香避入凤凰香,将白果四香避入凤凰香,3950.6493270397186
杜预认为知盈是知朔的弟弟。,杜豫认为知淫是知朔的弟弟,杜豫认为知淫是知朔的弟弟,杜预认为知盈是知朔的弟弟,杜豫认为知淫是知朔的弟弟,杜豫认为知淫是知朔的弟弟,3950.6493270397186
埃尔克内尔是德国勃兰登堡州的一个市镇。,埃尔克内尔是德国博南登堡州的一个市镇,埃尔克内尔是德国博南登堡州的一个市镇,埃尔克内尔是德国勃兰登堡州的一个市镇,埃尔克内尔是德国博南登堡州的一个市镇,埃尔克内尔是德国博南登堡州的一个市镇,3950.6493270397186
过去是藏传佛教噶当派重要寺院之一。,过去是藏传佛教噶当派重要寺院之一,过去是藏传佛教噶当派重要寺院之一,过去是藏传佛教噶当派重要寺院之一,过去是藏传佛教噶当派重要寺院之一,过去是藏传佛教噶当派重要寺院之一,3950.6493270397186
抑制震荡子在数学上的应用可能有助于从昼夜节律到内分泌等领域的研究。,抑制振荡子在数学上的运用可能有助于从昼夜节律到内分泌的领域的研究,抑制振荡子在数学上的运用可能有助于从昼夜节律到内分泌的领域的研究,抑制震荡子在数学上的应用可能有助于从昼夜节律到内分泌等领域的研究,抑制振荡子在数学上的运用可能有助于从昼夜节律到内分泌的领域的研究,抑制振荡子在数学上的运用可能有助于从昼夜节律到内分泌的领域的研究,3950.6493270397186
转移到香港的师团剩余单位不久即参加了豫湘桂会战中的湘桂会战攻占南宁。,转移到香港的师团剩余单位不久即参加了郁香贵会战中的香味会战攻占南宁,转移到香港的师团剩余单位不久即参加了郁香贵会战中的香味会战攻占南宁,转移到香港的师团剩余单位不久即参加了豫湘桂会战中的湘桂会战攻占南宁,转移到香港的师团剩余单位不久即参加了郁香贵会战中的香味会战攻占南宁,转移到香港的师团剩余单位不久即参加了郁香贵会战中的香味会战攻占南宁,3950.6493270397186
海明格是德国巴伐利亚州的一个市镇。,海宁格是德国巴伐利亚州的一个市镇,海宁格是德国巴伐利亚州的一个市镇,海明格是德国巴伐利亚州的一个市镇,海宁格是德国巴伐利亚州的一个市镇,海宁格是德国巴伐利亚州的一个市镇,3950.6493270397186
米拉杜人口变化图示,米拉度人口变化图示,米拉度人口变化图示,米拉杜人口变化图示,米拉度人口变化图示,米拉度人口变化图示,3950.6493270397186
得名于捐款兴校的慈善家周荣富。,得名于捐款新校的慈善家周荣赋,得名于捐款新校的慈善家周荣赋,得名于捐款兴校的慈善家周荣富,得名于捐款新校的慈善家周荣赋,得名于捐款新校的慈善家周荣赋,3950.6493270397186
本种之下又可分为三个亚种。,本种之下又可分为三个亚种,本种之下又可分为三个亚种,本种之下又可分为三个亚种,本种之下又可分为三个亚种,本种之下又可分为三个亚种,3950.6493270397186
影片片尾曲则是与宫崎骏长期合作的音乐家久石让提供。,影片片尾曲则是与龚琦骏长期合作的音乐家九十让提供,影片片尾曲则是与龚琦骏长期合作的音乐家九十让提供,影片片尾曲则是与宫崎骏长期合作的音乐家久石让提供,影片片尾曲则是与龚琦骏长期合作的音乐家九十让提供,影片片尾曲则是与龚琦骏长期合作的音乐家九十让提供,3950.6493270397186
美国地区指的美国的正式政权机构外的区划。,美国地区指的美国的正式政权机构外的区划,美国地区指的美国的正式政权机构外的区划,美国地区指的美国的正式政权机构外的区划,美国地区指的美国的正式政权机构外的区划,美国地区指的美国的正式政权机构外的区划,3950.6493270397186
位于日本桥地域南部。,位于日本桥地狱南部,位于日本桥地狱南部,位于日本桥地域南部,位于日本桥地狱南部,位于日本桥地狱南部,3950.6493270397186
性情温和。,,,性情温和,,,3950.6493270397186
过了这关,过了这关,过了这关,过了这关,过了这关,过了这关,3950.6493270397186
圣让德韦尔日人口变化图示,是让德维尔日人口变化图示,是让德维尔日人口变化图示,圣让德韦尔日人口变化图示,是让德维尔日人口变化图示,是让德维尔日人口变化图示,3950.6493270397186
现是日本最大的公立大学之一。,现是日本最大的公立大学之一,现是日本最大的公立大学之一,现是日本最大的公立大学之一,现是日本最大的公立大学之一,现是日本最大的公立大学之一,3950.6493270397186
道光十六年任江苏嘉定县知县。,道光16年任 江苏嘉地县支县,道光16年任 江苏嘉地县支县,道光十六年任江苏嘉定县知县,道光16年任 江苏嘉地县支县,道光16年任 江苏嘉地县支县,3950.6493270397186
他曾在巴勒斯坦种族屠杀行动中担任副指挥。,他曾在巴勒斯坦种族屠杀行动中担任副指挥,他曾在巴勒斯坦种族屠杀行动中担任副指挥,他曾在巴勒斯坦种族屠杀行动中担任副指挥,他曾在巴勒斯坦种族屠杀行动中担任副指挥,他曾在巴勒斯坦种族屠杀行动中担任副指挥,3950.6493270397186
现效力于新加坡职业足球联赛球队淡滨尼流浪。,现效力于新加坡职业足球联赛球队但濒临流浪,现效力于新加坡职业足球联赛球队但濒临流浪,现效力于新加坡职业足球联赛球队淡滨尼流浪,现效力于新加坡职业足球联赛球队但濒临流浪,现效力于新加坡职业足球联赛球队但濒临流浪,3950.6493270397186
在我感觉起来非常準确的时间,在我感觉起来非常紧缺的时间,在我感觉起来非常紧缺的时间,在我感觉起来非常準确的时间,在我感觉起来非常紧缺的时间,在我感觉起来非常紧缺的时间,3950.6493270397186
永乐帝诏令交付史官。,永乐地 朝宁交付时光,永乐地 朝宁交付时光,永乐帝诏令交付史官,永乐地 朝宁交付时光,永乐地 朝宁交付时光,3950.6493270397186
小震旦光介为半花介科震旦光介属下的一个种。,小震荡光节为半花界科震荡光界属下的一个种,小震荡光节为半花界科震荡光界属下的一个种,小震旦光介为半花介科震旦光介属下的一个种,小震荡光节为半花界科震荡光界属下的一个种,小震荡光节为半花界科震荡光界属下的一个种,3950.6493270397186
